{
  "category": "NONE",
  "description": {
    "ar": "مثالي للاحتفاء بقائد عظيم.",
    "de": "Perfekt für einen Toast auf einen großen Anführer.",
    "en": "Perfect for toasting a great Leader.",
    "es": "Perfecto para brindar en honor de un gran líder.",
    "fr": "Parfait pour porter un toast au meilleur Guide qui soit.",
    "fr-CA": "Parfait pour porter un toast au meilleur Guide qui soit.",
    "it": "Perfetto per brindare a un grande leader.",
    "ja": "偉大な教祖様のために乾杯！",
    "ko": "위대한 교주를 위해 건배하기에 완벽합니다.",
    "nl": "Perfect om mee te toosten op een grote leider.",
    "pt-BR": "Perfeito para homenagear grandes Líderes.",
    "ru": "Лучшее, что можно выпить за здоровье ягнёнка.",
    "tr": "Yüce bir önderin şerefine kaldırmak için birebir.",
    "zh-CN": "适合举杯敬伟大教主。",
    "zh-TW": "適合舉杯敬偉大教主。"
  },
  "descriptionPlain": {
    "ar": "مثالي للاحتفاء بقائد عظيم.",
    "de": "Perfekt für einen Toast auf einen großen Anführer.",
    "en": "Perfect for toasting a great Leader.",
    "es": "Perfecto para brindar en honor de un gran líder.",
    "fr": "Parfait pour porter un toast au meilleur Guide qui soit.",
    "fr-CA": "Parfait pour porter un toast au meilleur Guide qui soit.",
    "it": "Perfetto per brindare a un grande leader.",
    "ja": "偉大な教祖様のために乾杯！",
    "ko": "위대한 교주를 위해 건배하기에 완벽합니다.",
    "nl": "Perfect om mee te toosten op een grote leider.",
    "pt-BR": "Perfeito para homenagear grandes Líderes.",
    "ru": "Лучшее, что можно выпить за здоровье ягнёнка.",
    "tr": "Yüce bir önderin şerefine kaldırmak için birebir.",
    "zh-CN": "适合举杯敬伟大教主。",
    "zh-TW": "適合舉杯敬偉大教主。"
  },
  "icon": "icons/items/DRINK_WINE.png",
  "id": "DRINK_WINE",
  "meal": {
    "cookTime": 42.0,
    "dlc": false,
    "effects": [
      {
        "chance": 75,
        "description": {
          "ar": "<sprite name=\"icon_FaithDown\"> فرصة لتشوش تابع بنسبة <color=#FFD201>75%</color>.",
          "de": "<sprite name=\"icon_FaithDown\"> <color=#FFD201>75 %</color> Chance, dass ein Anhänger duselig wird.",
          "en": "<sprite name=\"icon_FaithDown\"> <color=#FFD201>75%</color> chance of causing a Follower to become Befuddled.",
          "es": "<sprite name=\"icon_FaithDown\"> <color=#FFD201>75 %</color> de probabilidad de que al adepto le entre un mareíllo.",
          "fr": "<sprite name=\"icon_FaithDown\"> <color=#FFD201>75 %</color> de chances de donner l'esprit confus à un adepte.",
          "fr-CA": "<sprite name=\"icon_FaithDown\"> <color=#FFD201>75 %</color> de chances de donner l'esprit confus à un adepte.",
          "it": "<sprite name=\"icon_FaithDown\"> <color=#FFD201>75%</color> di possibilità che il membro del Culto soffra di stordimento.",
          "ja": "<sprite name=\"icon_FaithDown\"> <color=#FFD201>75%</color>の確率で信者が混乱する",
          "ko": "<sprite name=\"icon_FaithDown\"> <color=#FFD201>75%</color>의 확률로 추종자가 심신미약 상태가 됩니다.",
          "nl": "<sprite name=\"icon_FaithDown\"> <color=#FFD201>75%</color> kans dat een volgeling bedwelmd raakt.",
          "pt-BR": "<sprite name=\"icon_FaithDown\"> <color=#FFD201>75%</color> de chance de fazer com que o seguidor fique com Hiperidratação.",
          "ru": "<sprite name=\"icon_FaithDown\"> Последователь становится сконфуженным с вероятностью <color=#FFD201>75%</color>.",
          "tr": "<sprite name=\"icon_FaithDown\"> <color=#FFD201>%75</color> ihtimalle bir Takipçi'nin sersemlemesine yol açar.",
          "zh-CN": "<sprite name=\"icon_FaithDown\"> <color=#FFD201>75%</color> 机率使教徒神智不清。",
          "zh-TW": "<sprite name=\"icon_FaithDown\"> <color=#FFD201>75%</color> 機率使教徒神智不清。"
        },
        "descriptionPlain": {
          "ar": "فرصة لتشوش تابع بنسبة 75%.",
          "de": "75 % Chance, dass ein Anhänger duselig wird.",
          "en": "75% chance of causing a Follower to become Befuddled.",
          "es": "75 % de probabilidad de que al adepto le entre un mareíllo.",
          "fr": "75 % de chances de donner l'esprit confus à un adepte.",
          "fr-CA": "75 % de chances de donner l'esprit confus à un adepte.",
          "it": "75% di possibilità che il membro del Culto soffra di stordimento.",
          "ja": "75%の確率で信者が混乱する",
          "ko": "75%의 확률로 추종자가 심신미약 상태가 됩니다.",
          "nl": "75% kans dat een volgeling bedwelmd raakt.",
          "pt-BR": "75% de chance de fazer com que o seguidor fique com Hiperidratação.",
          "ru": "Последователь становится сконфуженным с вероятностью 75%.",
          "tr": "%75 ihtimalle bir Takipçi'nin sersemlemesine yol açar.",
          "zh-CN": "75% 机率使教徒神智不清。",
          "zh-TW": "75% 機率使教徒神智不清。"
        },
        "type": "CausesDrunk"
      },
      {
        "chance": 25,
        "description": {
          "ar": "<sprite name=\"icon_FaithUp\"> فرصة لزيادة إخلاص تابع بنسبة <color=#FFD201>25%</color>.",
          "de": "<sprite name=\"icon_FaithUp\"> <color=#FFD201>25 %</color> Chance, dass sich die Anhängerloyalität erhöht.",
          "en": "<sprite name=\"icon_FaithUp\"> <color=#FFD201>25%</color> chance of increasing Follower loyalty.",
          "es": "<sprite name=\"icon_FaithUp\"> <color=#FFD201>25 %</color> de probabilidad de aumentar la lealtad de los adeptos",
          "fr": "<sprite name=\"icon_FaithUp\"> <color=#FFD201>25 %</color> de chances d'augmenter la fidélité de l'adepte.",
          "fr-CA": "<sprite name=\"icon_FaithUp\"> <color=#FFD201>25 %</color> de chances d'accroître la fidélité de l'adepte.",
          "it": "<sprite name=\"icon_FaithUp\"> <color=#FFD201>25%</color> di possibilità che il membro del Culto aumenti la sua Fedeltà.",
          "ja": "<sprite name=\"icon_FaithUp\"> <color=#FFD201>25%</color>の確率で信者の忠誠心が上昇する",
          "ko": "<sprite name=\"icon_FaithUp\"> <color=#FFD201>25%</color>의 확률로 추종자의 충성심이 상승합니다",
          "nl": "<sprite name=\"icon_FaithUp\"> <color=#FFD201>25%</color> kans op het verhogen van loyaliteit van volgelingen.",
          "pt-BR": "<sprite name=\"icon_FaithUp\"> <color=#FFD201>25%</color> de chance de aumentar a lealdade do seguidor",
          "ru": "<sprite name=\"icon_FaithUp\"> Последователь проникается к вам доверием с вероятностью <color=#FFD201>25%</color>.",
          "tr": "<sprite name=\"icon_FaithUp\"> <color=#FFD201>%25</color> ihtimalle Takipçi bağlılığını artırır.",
          "zh-CN": "<sprite name=\"icon_FaithUp\"> <color=#FFD201>25%</color> 机率提高教徒忠诚度",
          "zh-TW": "<sprite name=\"icon_FaithUp\"> <color=#FFD201>25%</color> 機率提高教徒忠誠度"
        },
        "descriptionPlain": {
          "ar": "فرصة لزيادة إخلاص تابع بنسبة 25%.",
          "de": "25 % Chance, dass sich die Anhängerloyalität erhöht.",
          "en": "25% chance of increasing Follower loyalty.",
          "es": "25 % de probabilidad de aumentar la lealtad de los adeptos",
          "fr": "25 % de chances d'augmenter la fidélité de l'adepte.",
          "fr-CA": "25 % de chances d'accroître la fidélité de l'adepte.",
          "it": "25% di possibilità che il membro del Culto aumenti la sua Fedeltà.",
          "ja": "25%の確率で信者の忠誠心が上昇する",
          "ko": "25%의 확률로 추종자의 충성심이 상승합니다",
          "nl": "25% kans op het verhogen van loyaliteit van volgelingen.",
          "pt-BR": "25% de chance de aumentar a lealdade do seguidor",
          "ru": "Последователь проникается к вам доверием с вероятностью 25%.",
          "tr": "%25 ihtimalle Takipçi bağlılığını artırır.",
          "zh-CN": "25% 机率提高教徒忠诚度",
          "zh-TW": "25% 機率提高教徒忠誠度"
        },
        "type": "IncreasesLoyalty"
      }
    ],
    "faith": 0,
    "recipes": [
      [
        {
          "item": "GRAPES",
          "quantity": 5
        }
      ]
    ],
    "satiation": 0,
    "satiationPlayer": 50,
    "stars": 2,
    "tummyRating": 0.25
  },
  "name": {
    "ar": "شراب العنب",
    "de": "Traubennektar",
    "en": "Grape Nectar",
    "es": "Néctar de uva",
    "fr": "Nectar de raisin",
    "fr-CA": "Nectar de raisin",
    "it": "Nettare d'uva",
    "ja": "グレープネクター",
    "ko": "포도 음료",
    "nl": "Druivennectar",
    "pt-BR": "Néctar de Uva",
    "ru": "Виноградный нектар",
    "tr": "Üzüm Nektarı",
    "zh-CN": "葡萄琼浆",
    "zh-TW": "葡萄瓊漿"
  },
  "namePlain": {
    "ar": "شراب العنب",
    "de": "Traubennektar",
    "en": "Grape Nectar",
    "es": "Néctar de uva",
    "fr": "Nectar de raisin",
    "fr-CA": "Nectar de raisin",
    "it": "Nettare d'uva",
    "ja": "グレープネクター",
    "ko": "포도 음료",
    "nl": "Druivennectar",
    "pt-BR": "Néctar de Uva",
    "ru": "Виноградный нектар",
    "tr": "Üzüm Nektarı",
    "zh-CN": "葡萄琼浆",
    "zh-TW": "葡萄瓊漿"
  },
  "tags": [
    "drink"
  ]
}
