{
  "category": "NONE",
  "description": {
    "de": "Gedünstete Pilze, die hoffentlich ungiftig sind.",
    "en": "Sauteed mushrooms, hopefully not poisonous.",
    "es": "Setas salteadas; esperemos que no sean venenosas.",
    "fr": "Poêlée de champignons comestibles, avec un peu de chance...",
    "fr-CA": "Sauté de champignons, non toxiques avec un peu de chance.",
    "it": "Funghi saltati in padella, si spera non velenosi.",
    "ja": "キノコを炒めて作った料理。毒キノコでないことを祈ろう。",
    "ko": "볶은 버섯입니다. 다행히 독은 없습니다.",
    "nl": "Gebakken paddenstoelen, hopelijk geen giftige.",
    "pt-BR": "Tomara que esses cogumelos refogados não sejam venenosos.",
    "ru": "Блюдо из грибов, которые выглядели неядовитыми.",
    "tr": "Sote mantar, şanlıysan zehirli değildir.",
    "zh-CN": "煎蘑菇，希望没有毒。",
    "zh-TW": "煎蘑菇，希望沒有毒。"
  },
  "descriptionPlain": {
    "de": "Gedünstete Pilze, die hoffentlich ungiftig sind.",
    "en": "Sauteed mushrooms, hopefully not poisonous.",
    "es": "Setas salteadas; esperemos que no sean venenosas.",
    "fr": "Poêlée de champignons comestibles, avec un peu de chance...",
    "fr-CA": "Sauté de champignons, non toxiques avec un peu de chance.",
    "it": "Funghi saltati in padella, si spera non velenosi.",
    "ja": "キノコを炒めて作った料理。毒キノコでないことを祈ろう。",
    "ko": "볶은 버섯입니다. 다행히 독은 없습니다.",
    "nl": "Gebakken paddenstoelen, hopelijk geen giftige.",
    "pt-BR": "Tomara que esses cogumelos refogados não sejam venenosos.",
    "ru": "Блюдо из грибов, которые выглядели неядовитыми.",
    "tr": "Sote mantar, şanlıysan zehirli değildir.",
    "zh-CN": "煎蘑菇，希望没有毒。",
    "zh-TW": "煎蘑菇，希望沒有毒。"
  },
  "icon": "icons/items/MEAL_MUSHROOMS.png",
  "id": "MEAL_MUSHROOMS",
  "meal": {
    "cookTime": 42.0,
    "dlc": false,
    "effects": [],
    "faith": 0,
    "recipes": [],
    "satiation": 60,
    "satiationPlayer": 25,
    "stars": 1,
    "tummyRating": 0.25
  },
  "name": {
    "de": "Pilzmahlzeit",
    "en": "Mushroom Meal",
    "es": "Plato de setas",
    "fr": "Plat de champignons",
    "fr-CA": "Plat de champignons",
    "it": "Piatto di funghi",
    "ja": "キノコ料理",
    "ko": "버섯 음식",
    "nl": "Paddenstoelenmaaltijd",
    "pt-BR": "Refeição de Cogumelos",
    "ru": "Тушёные грибы",
    "tr": "Mantar Yemeği",
    "zh-CN": "蘑菇餐",
    "zh-TW": "蘑菇餐"
  },
  "namePlain": {
    "de": "Pilzmahlzeit",
    "en": "Mushroom Meal",
    "es": "Plato de setas",
    "fr": "Plat de champignons",
    "fr-CA": "Plat de champignons",
    "it": "Piatto di funghi",
    "ja": "キノコ料理",
    "ko": "버섯 음식",
    "nl": "Paddenstoelenmaaltijd",
    "pt-BR": "Refeição de Cogumelos",
    "ru": "Тушёные грибы",
    "tr": "Mantar Yemeği",
    "zh-CN": "蘑菇餐",
    "zh-TW": "蘑菇餐"
  },
  "tags": [
    "meal"
  ]
}
